{
  "messageId": "c1d2e3f4-a5b6-4c7d-8e9f-0a1b2c3d4e5f",
  "type": "counter",
  "from": "cafe.test",
  "to": "roaster.test",
  "conversationId": "0b9e8d7c-6a5b-4c3d-8e2f-1a0b9c8d7e6f",
  "sentAt": "2026-11-03T10:00:12Z",
  "body": {
    "quoteId": "9a8b7c6d-5e4f-4a3b-8c2d-1e0f9a8b7c6d",
    "unitPrice": { "amount": "10.83", "currency": "USD" }
  }
}
