{
  "messageId": "a7b8c9d0-e1f2-4a3b-9c4d-5e6f7a8b9c0d",
  "type": "accept",
  "from": "cafe.test",
  "to": "roaster.test",
  "conversationId": "0b9e8d7c-6a5b-4c3d-8e2f-1a0b9c8d7e6f",
  "sentAt": "2026-11-03T10:00:30Z",
  "body": {
    "quoteId": "4d3c2b1a-0f9e-4d8c-8b7a-6f5e4d3c2b1a",
    "billTo": { "name": "Corner Café", "email": "buyer@example.com" }
  }
}
