{
  "messageId": "6f1c2b7e-3d4a-4f8e-9b1a-2c3d4e5f6a7b",
  "type": "rfq",
  "from": "cafe.test",
  "to": "roaster.test",
  "conversationId": "0b9e8d7c-6a5b-4c3d-8e2f-1a0b9c8d7e6f",
  "sentAt": "2026-11-03T10:00:00Z",
  "body": {
    "product": "green coffee beans",
    "origin": "Brazil",
    "quantity": "50",
    "unit": "kg",
    "deliverBy": "2026-11-07"
  }
}
