{
  "messageId": "4d3c2b1a-0f9e-4d8c-8b7a-6f5e4d3c2b1a",
  "type": "quote",
  "from": "roaster.test",
  "to": "cafe.test",
  "conversationId": "0b9e8d7c-6a5b-4c3d-8e2f-1a0b9c8d7e6f",
  "sentAt": "2026-11-03T10:00:13Z",
  "body": {
    "rfqId": "6f1c2b7e-3d4a-4f8e-9b1a-2c3d4e5f6a7b",
    "supplierName": "Roaster & Co",
    "simulated": false,
    "unitPrice": { "amount": "10.83", "currency": "USD" },
    "quantity": "50",
    "availableQuantity": "320",
    "unit": "kg",
    "deliveryDate": "2026-11-05",
    "validUntil": "2026-11-04T10:00:13Z",
    "note": "We can meet 10.83 USD per kg.",
    "revises": "9a8b7c6d-5e4f-4a3b-8c2d-1e0f9a8b7c6d"
  }
}
